{
  "created_at": "2026-08-18T23:43:25.495762+00:00",
  "environment": {
    "cpu_model": "Intel(R) Core(TM) i5-7500 CPU @ 3.40GHz",
    "hardware_label": "Iras-iMac.local-iMac18,3-i5-7500",
    "kernel": "22.6.0",
    "logical_cpus": 4,
    "machine": "x86_64",
    "operating_system": "macOS-13.7.8-x86_64-i386-64bit",
    "physical_board": false,
    "rss_sampler": "darwin-ps-rss",
    "rust_host_triple": "x86_64-apple-darwin",
    "total_memory_bytes": 68719476736
  },
  "evidence_id": "CPY-CAPACITY-HOST-HEADLESS-9382b050",
  "method": {
    "candidates": [
      {
        "candidate_id": "i8-e16-t4",
        "egress_capacity": 16,
        "ingress_capacity": 8,
        "turn_budget": 4
      },
      {
        "candidate_id": "i16-e32-t8",
        "egress_capacity": 32,
        "ingress_capacity": 16,
        "turn_budget": 8
      },
      {
        "candidate_id": "i32-e64-t16",
        "egress_capacity": 64,
        "ingress_capacity": 32,
        "turn_budget": 16
      },
      {
        "candidate_id": "i64-e128-t32",
        "egress_capacity": 128,
        "ingress_capacity": 64,
        "turn_budget": 32
      }
    ],
    "clock": "std::time::Instant monotonic clock",
    "egress_payload_bytes": 128,
    "ingress_payload_bytes": 256,
    "iterations": 5,
    "limitations": [
      "Transport-only workload executes an empty neutral Endpoint Safe Turn; it does not measure actor, render, frame, input, Python, PyO3, or OS-readiness work.",
      "Owned-envelope bytes exclude Crossbeam channel allocation and process overhead; peak RSS separately measures the whole native process.",
      "Empty-to-nonempty values are observed queue transitions, not eventfd or self-pipe wakeup counts.",
      "Candidate values are evidence inputs and this bundle makes no default, maximum, budget, or ratification decision.",
      "Host results cannot satisfy the CPY-01 embedded-Linux reference-board requirement."
    ],
    "messages": 1024,
    "observer_stall_us": 50000,
    "retry_backoff_us": 50,
    "sampling_hold_us": 20000,
    "scenarios": [
      "cold-burst",
      "sustained",
      "observer-stall"
    ],
    "warmups": 1
  },
  "normative_decision": false,
  "profile": "host-headless",
  "qualification": "diagnostic-host",
  "runs": [
    {
      "candidate_id": "i8-e16-t4",
      "iteration": 1,
      "peak_rss_bytes": 749568,
      "probe": {
        "accepted_requests": 8,
        "completed_records": 8,
        "config": {
          "egress_capacity": 16,
          "egress_payload_bytes": 128,
          "ingress_capacity": 8,
          "ingress_payload_bytes": 256,
          "messages": 1024,
          "observer_stall_us": 0,
          "retry_backoff_us": 50,
          "sampling_hold_us": 20000,
          "scenario": "cold-burst",
          "turn_budget": 4
        },
        "consumer_checksum": 13584530413848762880,
        "delivery_latency": {
          "maximum_ns": 253208,
          "mean_ns": 252698,
          "minimum_ns": 252324,
          "p50_ns": 252719,
          "p95_ns": 253208,
          "p99_ns": 253208,
          "samples": 8
        },
        "egress_backpressure_ns": 0,
        "egress_backpressured_records": 0,
        "egress_empty_to_nonempty_observations": 1,
        "ingress_empty_to_nonempty_observations": 1,
        "ingress_full_observations": 1016,
        "offered_requests": 1024,
        "owned_envelope_bytes_at_end": 0,
        "peak_egress_depth": 8,
        "peak_ingress_depth": 8,
        "peak_owned_envelope_bytes": 2736,
        "probe_duration_ns": 294567,
        "retained_bytes_scope": "owned caller/service/queue request and record structs plus payload capacities; channel allocator and process overhead excluded",
        "schema_version": "CPY-CAPACITY-PROBE-1",
        "sequence_errors": 0,
        "service_checksum": 6475225942468736000,
        "service_latency": {
          "maximum_ns": 204034,
          "mean_ns": 202913,
          "minimum_ns": 201698,
          "p50_ns": 203201,
          "p95_ns": 204034,
          "p99_ns": 204034,
          "samples": 8
        },
        "service_turns": 2,
        "terminal_admission_rejections": 1016,
        "workload": "bounded-crossbeam-transport-with-empty-endpoint-safe-turn"
      },
      "rss_source": "darwin-ps-rss"
    },
    {
      "candidate_id": "i8-e16-t4",
      "iteration": 2,
      "peak_rss_bytes": 724992,
      "probe": {
        "accepted_requests": 8,
        "completed_records": 8,
        "config": {
          "egress_capacity": 16,
          "egress_payload_bytes": 128,
          "ingress_capacity": 8,
          "ingress_payload_bytes": 256,
          "messages": 1024,
          "observer_stall_us": 0,
          "retry_backoff_us": 50,
          "sampling_hold_us": 20000,
          "scenario": "cold-burst",
          "turn_budget": 4
        },
        "consumer_checksum": 13584530413848762880,
        "delivery_latency": {
          "maximum_ns": 301363,
          "mean_ns": 300366,
          "minimum_ns": 299928,
          "p50_ns": 300329,
          "p95_ns": 301363,
          "p99_ns": 301363,
          "samples": 8
        },
        "egress_backpressure_ns": 0,
        "egress_backpressured_records": 0,
        "egress_empty_to_nonempty_observations": 1,
        "ingress_empty_to_nonempty_observations": 1,
        "ingress_full_observations": 1016,
        "offered_requests": 1024,
        "owned_envelope_bytes_at_end": 0,
        "peak_egress_depth": 8,
        "peak_ingress_depth": 8,
        "peak_owned_envelope_bytes": 2736,
        "probe_duration_ns": 338750,
        "retained_bytes_scope": "owned caller/service/queue request and record structs plus payload capacities; channel allocator and process overhead excluded",
        "schema_version": "CPY-CAPACITY-PROBE-1",
        "sequence_errors": 0,
        "service_checksum": 6475225942468736000,
        "service_latency": {
          "maximum_ns": 243559,
          "mean_ns": 242466,
          "minimum_ns": 241121,
          "p50_ns": 242857,
          "p95_ns": 243559,
          "p99_ns": 243559,
          "samples": 8
        },
        "service_turns": 2,
        "terminal_admission_rejections": 1016,
        "workload": "bounded-crossbeam-transport-with-empty-endpoint-safe-turn"
      },
      "rss_source": "darwin-ps-rss"
    },
    {
      "candidate_id": "i8-e16-t4",
      "iteration": 3,
      "peak_rss_bytes": 753664,
      "probe": {
        "accepted_requests": 8,
        "completed_records": 8,
        "config": {
          "egress_capacity": 16,
          "egress_payload_bytes": 128,
          "ingress_capacity": 8,
          "ingress_payload_bytes": 256,
          "messages": 1024,
          "observer_stall_us": 0,
          "retry_backoff_us": 50,
          "sampling_hold_us": 20000,
          "scenario": "cold-burst",
          "turn_budget": 4
        },
        "consumer_checksum": 13584530413848762880,
        "delivery_latency": {
          "maximum_ns": 206613,
          "mean_ns": 205548,
          "minimum_ns": 204763,
          "p50_ns": 205605,
          "p95_ns": 206613,
          "p99_ns": 206613,
          "samples": 8
        },
        "egress_backpressure_ns": 0,
        "egress_backpressured_records": 0,
        "egress_empty_to_nonempty_observations": 6,
        "ingress_empty_to_nonempty_observations": 1,
        "ingress_full_observations": 1016,
        "offered_requests": 1024,
        "owned_envelope_bytes_at_end": 0,
        "peak_egress_depth": 3,
        "peak_ingress_depth": 8,
        "peak_owned_envelope_bytes": 2736,
        "probe_duration_ns": 266482,
        "retained_bytes_scope": "owned caller/service/queue request and record structs plus payload capacities; channel allocator and process overhead excluded",
        "schema_version": "CPY-CAPACITY-PROBE-1",
        "sequence_errors": 0,
        "service_checksum": 6475225942468736000,
        "service_latency": {
          "maximum_ns": 206055,
          "mean_ns": 204635,
          "minimum_ns": 203159,
          "p50_ns": 204836,
          "p95_ns": 206055,
          "p99_ns": 206055,
          "samples": 8
        },
        "service_turns": 2,
        "terminal_admission_rejections": 1016,
        "workload": "bounded-crossbeam-transport-with-empty-endpoint-safe-turn"
      },
      "rss_source": "darwin-ps-rss"
    },
    {
      "candidate_id": "i8-e16-t4",
      "iteration": 4,
      "peak_rss_bytes": 737280,
      "probe": {
        "accepted_requests": 8,
        "completed_records": 8,
        "config": {
          "egress_capacity": 16,
          "egress_payload_bytes": 128,
          "ingress_capacity": 8,
          "ingress_payload_bytes": 256,
          "messages": 1024,
          "observer_stall_us": 0,
          "retry_backoff_us": 50,
          "sampling_hold_us": 20000,
          "scenario": "cold-burst",
          "turn_budget": 4
        },
        "consumer_checksum": 13584530413848762880,
        "delivery_latency": {
          "maximum_ns": 447550,
          "mean_ns": 446278,
          "minimum_ns": 445764,
          "p50_ns": 446193,
          "p95_ns": 447550,
          "p99_ns": 447550,
          "samples": 8
        },
        "egress_backpressure_ns": 0,
        "egress_backpressured_records": 0,
        "egress_empty_to_nonempty_observations": 1,
        "ingress_empty_to_nonempty_observations": 1,
        "ingress_full_observations": 1016,
        "offered_requests": 1024,
        "owned_envelope_bytes_at_end": 0,
        "peak_egress_depth": 8,
        "peak_ingress_depth": 8,
        "peak_owned_envelope_bytes": 2736,
        "probe_duration_ns": 529781,
        "retained_bytes_scope": "owned caller/service/queue request and record structs plus payload capacities; channel allocator and process overhead excluded",
        "schema_version": "CPY-CAPACITY-PROBE-1",
        "sequence_errors": 0,
        "service_checksum": 6475225942468736000,
        "service_latency": {
          "maximum_ns": 424467,